ad_deal_type,url,creationDate,author_type,isApartments,probably_fraud,parsed_address,lat,lng,floorNumber,roomsCount,loggiasCount,balconiesCount,totalArea,livingArea,kitchenArea,decoration,hasFurniture,buildYear,floorsCount,materialType,passengerLiftsCount,cargoLiftsCount,demolishedInMoscowProgramm,priceTotal,currency,sale_terms,bargainAllowed,mortgageAllowed,utilities_price,utilities_in_price,utilities_flow_not_in_price,agent_reward_currency,agent_reward_payment_type,agent_reward_price,agentFee,deposit,title,description,isAuction,cian_price_range,photo_url_list,search_alias,search_page_load_dttm,offer_page_load_dttm,isFromDeveloper,isFromBuilder,isFromSeller,isFromLeadFactory,parking,ceilingHeight,cranageTypes,houseMaterialType,entrances,flatCount,isEmergency,houseHeatSupplyType,houseOverhaulFundType,houseGasSupplyType,houseOverlapType,seriesName,lifts,editDate,externalOfferUrl,isIllegalConstruction,isCianPartner,repairType,windowsViewType,isPenthouse,flatType,isInHiddenBase,isObjectHidden,isClosedVisibility,videos,object_guid,wc_type,elevator_descr,today_views,total_views,price_history,seo_media_title_full,seo_media_title_short,seo_main_title,seo_descr,sidebar_info,ad_is_closed
sale_secondary,https://www.cian.ru/sale/flat/314366131/,2025-03-01T18:13:43.05,specialist,,False,"г Москва, г Москва, ул Нагатинская, 4к3",55.680159,37.632628,6,3,1.0,,73.0,26.0,28.0,,True,2020,12,brick,,,False,41500000,rur,free,,True,,,,,,,,,,"id:406. 
Продается трехкомнатная квартира  в престижном Клубном доме  ""Счастье в Садовниках""! Это идеальное место для тех, кто ценит комфорт, стиль и современный образ жизни. 
 
О КВАРТИРЕ  
Квартира имеют продуманный план: просторная кухня-гостиная, две уютные изолированные спальни с дизайнерской мебелью, ванная комната и гостевой санузел (вся сантехника фирмы GROHE)
Квартира полностью меблирована и укомплектована новой и современной встраиваемой техникой, что позволяет вам сразу же наслаждаться жизнью без лишних хлопот. Дополнительный комфорт обеспечивают теплые полы и мульти-сплит система кондиционирования - Haier , а шумоизоляция гарантирует тишину и спокойствие. В квартире так же проведена приточная система вентиляции Salda, установлены магистральные фильтры на воду и датчики протечки в каждой мокрой зоне. 
 
Высота потолков в квартире составляет 3 метра, что создает ощущение простора и легкости. Из окон открывается захватывающий панорамный вид на живописные окрестности, наполняя квартиру светом и воздухом.
 
О КОМПЛЕКСЕ 
Жилой комплекс предлагает подземный паркинг и круглосуточную охрану. Закрытая территория без машин с детскими и спортивными площадками станет настоящим оазисом для вашей семьи.
 
РАСПОЛОЖЕНИЕ 
""Счастье в Садовниках "" находится в экологически чистой зоне рядом с Москвой-рекой, что дает возможность прогуляться по пешеходной набережной с велодорожками и смотровыми площадками
 
 
Не упустите возможность стать владельцем этой уникальной квартиры в  ЖК ""Счастье в Садовниках""! 

Также отдельно в продаже 2 парковочных места на подземном паркинге, одно из которых с зарядкой для электрокаров. 
 
Мы даем возможность покупателям приобрести недвижимость в ипотеку по самым низким ставкам в ведущих банках России. Содействуем в получении положительного ипотечного решения в 30-ти банках-партнёрах, со скидкой в 11-ти банках. Оказываем юридическое сопровождение, консультирование и обеспечиваем безопасный расчёт.

Звоните прямо сейчас, чтобы узнать подробности и записаться на просмотр!",False,,"['https://images.cdn-cian.ru/images/2416286880-1.jpg', 'https://images.cdn-cian.ru/images/2416286881-1.jpg', 'https://images.cdn-cian.ru/images/2416286883-1.jpg', 'https://images.cdn-cian.ru/images/2416286885-1.jpg', 'https://images.cdn-cian.ru/images/2416286887-1.jpg', 'https://images.cdn-cian.ru/images/2416286891-1.jpg', 'https://images.cdn-cian.ru/images/2416286892-1.jpg', 'https://images.cdn-cian.ru/images/2416286893-1.jpg', 'https://images.cdn-cian.ru/images/2416286895-1.jpg', 'https://images.cdn-cian.ru/images/2416286898-1.jpg', 'https://images.cdn-cian.ru/images/2416286900-1.jpg', 'https://images.cdn-cian.ru/images/2416286902-1.jpg', 'https://images.cdn-cian.ru/images/2416286906-1.jpg', 'https://images.cdn-cian.ru/images/2416286907-1.jpg', 'https://images.cdn-cian.ru/images/2416286912-1.jpg', 'https://images.cdn-cian.ru/images/2416286913-1.jpg', 'https://images.cdn-cian.ru/images/2416286918-1.jpg', 'https://images.cdn-cian.ru/images/2416286922-1.jpg', 'https://images.cdn-cian.ru/images/2416286926-1.jpg', 'https://images.cdn-cian.ru/images/2416286928-1.jpg', 'https://images.cdn-cian.ru/images/2416286934-1.jpg', 'https://images.cdn-cian.ru/images/2416286935-1.jpg']",district%5B78%5D=91,2025-03-08 01:02,2025-03-23 23:25,False,False,False,False,{'type': 'underground'},3.0,[],monolith,1,82,False,central,regionalOp,without,concrete,Индивидуальный проект,3,2025-03-22T17:03:27.097000+00:00,,False,False,design,,,rooms,False,False,False,[],cbe0d61f-d601-4453-ae2e-53a93edacf9b,"1 совмещенный, 1 раздельный",,13,540,"[('2025-03-18T15:52:43.491241+00:00', 41500000), ('2025-03-01T15:13:44.068958+00:00', 42000000)]","Продаётся, 3-комнатная квартира, за 41 500 000 ₽, 73.0 м², этаж 6/12","Продаётся, 3-комн. кв., за 41 500 000 ₽","Продажа трехкомнатной квартиры 73.0м² Нагатинская ул., 4К3, Москва, ЮАО, р-н Нагатино-Садовники м. Нагатинская - база ЦИАН, объявление 314366131","➜ Купите трехкомнатную квартиру площадью 73.0м² Нагатинская ул., 4К3, Москва, ЮАО, р-н Нагатино-Садовники м. Нагатинская. Цена продажи - 41 500 000 руб. Недвижимость на ЦИАН - объявление 314366131","[{'title': 'Цена за метр', 'value': '568 493 ₽/м²'}, {'title': 'Условия сделки', 'value': 'свободная продажа'}, {'title': 'Ипотека', 'value': 'возможна'}]",False
